,_id,PERMIT_NUM,REVISION_NUM,PERMIT_TYPE,STRUCTURE_TYPE,WORK,STREET_NUM,STREET_NAME,STREET_TYPE,STREET_DIRECTION,POSTAL,GEO_ID,WARD_GRID,APPLICATION_DATE,ISSUED_DATE,COMPLETED_DATE,STATUS,DESCRIPTION,CURRENT_USE,PROPOSED_USE,DWELLING_UNITS_CREATED,DWELLING_UNITS_LOST,EST_CONST_COST,ASSEMBLY,INSTITUTIONAL,RESIDENTIAL,BUSINESS_AND_PERSONAL_SERVICES,MERCANTILE,INDUSTRIAL,INTERIOR_ALTERATIONS,DEMOLITION,BUILDER_NAME
228376,228377,22 204431 BLD,0,Small Residential Projects,2 Unit - Detached,Second Suite (New),21,BRAYMORE,BLVD, ,M1B,311287.0,E2529,2022-09-16,2023-01-05,,Inspection,Proposal for basement second suite and interior alterations to ground floor,Sfd Detached,2 Units Detached,1.0,0.0,"600,000",0.0,0.0,0.0,0.0,0.0,0.0,10.0,0.0,
228377,228378,22 204431 BLD,1,Small Residential Projects,2 Unit - Detached,Second Suite (New),21,BRAYMORE,BLVD, ,M1B,311287.0,E2529,2023-05-31,2023-07-05,,Revision Issued,Minor changes in the basement and keeping the stairs in the original condition.,Sfd Detached,2 Units Detached,1.0,0.0,0,0.0,0.0,0.0,0.0,0.0,0.0,0.0,0.0,
228485,228486,22 205141 BLD,0,Small Residential Projects,2 Unit - Detached,Second Suite (New),18,LA PEER,BLVD, ,M1W,352993.0,E2222,2022-09-18,2023-04-05,,Permit Issued,proposing to renovate existing basement to convert it into a new second suite ,Sfd,Sfd,1.0,0.0,20000,0.0,0.0,0.0,0.0,0.0,0.0,0.0,0.0,
228882,228883,22 206734 BLD,0,Small Residential Projects,2 Unit - Semi-detached,Second Suite (New),309,HARBORD,ST, ,M6G,817376.0,S1133,2022-09-21,,,Issuance Pending,Proposed interior alterations and basement unit,Sfd,2unit,0.0,0.0,150000,0.0,0.0,0.0,0.0,0.0,0.0,166.25,0.0,
228998,228999,22 207195 BLD,0,Small Residential Projects,2 Unit - Semi-detached,Second Suite (New),121,WATSON,AVE, ,M6S,10663775.0,S0421,2022-09-22,2022-10-21,,Inspection,Proposed creation of secondary suite on main floor and basement in rear of semi-detached,Sfd Semi-Detached,2-Unit Semi-Detached,1.0,0.0,"80,000",0.0,0.0,0.0,0.0,0.0,0.0,33.67,0.0,
229074,229075,22 207764 BLD,0,Small Residential Projects,2 Unit - Detached,Second Suite (New),15,SHADOWBROOK,DR, ,M9B,1031298.0,W0227,2022-09-23,2022-11-14,,Permit Issued,1. Change of use from sfd to two unit dwelling (as-built).2. 1- proposed window in basement.,Sfd,2unit,1.0,0.0,46000,0.0,0.0,0.0,0.0,0.0,0.0,91.83,0.0,
229113,229114,22 207866 BLD,0,Small Residential Projects,2 Unit - Detached,Second Suite (New),38,DASHWOOD,CRES, ,M9V,9779673.0,W0126,2022-09-23,2022-11-18,,Inspection,Interior alteration to create a second suite in the basement of the existing sfd,Sfd,2- Unit Sfd,1.0,0.0,"40,000",0.0,0.0,0.0,0.0,0.0,0.0,0.0,0.0,
229417,229418,22 210363 BLD,0,Small Residential Projects,2 Unit - Detached,Second Suite (New),37,ARLINGTON,AVE, ,M6G,2375902.0,S1234,2022-09-28,2022-12-14,,Permit Issued,"Proposed interior alterations to all floors, a new Secondary Suite at the Basement Floor level, and  underpinning of basement of an Existing Semi-Detached House, on a corner lot. Proposal also include re-construction of the existing detached garage at the rear yard, rear deck, extension of basement walkout",Sfd,2-Unit Sfd,0.0,0.0,"450,000",0.0,0.0,0.0,0.0,0.0,0.0,154.06,0.0,
229454,229455,22 210476 BLD,0,Small Residential Projects,3+ Unit - Detached,Second Suite (New),865,LANSDOWNE,AVE, ,M6H,830793.0,S0930,2022-09-28,,,Examiner's Notice Sent,Proposed basement unit,2unit,3 Dwelling Units,1.0,0.0,100000,0.0,0.0,0.0,0.0,0.0,0.0,112.0,0.0,
229583,229584,22 211282 BLD,0,Small Residential Projects,2 Unit - Detached,Second Suite (New),189,KINGSVIEW,BLVD, ,M9R,1011238.0,W0133,2022-09-30,2022-12-01,,Inspection,Proposal to convert basement to second suite and interior alterations to main floor,Sfd Detached,2 Units Detached,1.0,0.0,"50,000",0.0,0.0,0.0,0.0,0.0,0.0,4.0,0.0,
229607,229608,22 211404 BLD,0,Small Residential Projects,2 Unit - Detached,Second Suite (New),96,FLORA,DR, ,M1P,335134.0,E2133,2022-09-30,2022-10-14,,Inspection,1. Change of use from SFD to TUD (as-built).2. 1- enlarge & 1-proposed window in basement.,Sfd,2unit,0.0,0.0,51000,0.0,0.0,0.0,0.0,0.0,0.0,84.85,0.0,
229666,229667,22 211637 BLD,0,Small Residential Projects,2 Unit - Detached,Second Suite (New),23,BORNHOLM,DR, ,M1C,310516.0,E2536,2022-10-01,2023-04-04,,Permit Issued,SECOND DWELLING UNIT IN BASEMENT-THREE(3) ENLARGED WINDOWS IN BASEMENT-ONE(1) NEW WINDOW IN BASEMENT,Sfd,2 Unit Dwellimg,1.0,0.0,66310,0.0,0.0,0.0,0.0,0.0,0.0,0.0,0.0,
229870,229871,22 212609 BLD,0,Small Residential Projects,2 Unit - Detached,Second Suite (New),36,CARSLAKE,CRES, ,M1J,316844.0,E2135,2022-10-03,2023-06-26,,Permit Issued,"Proposed interior alterations to basement to legalize secondary suite, minor alterations to ground floor to accommodate secondary suite",Sfd,2 Unit Sfd,1.0,0.0,20000,0.0,0.0,5.0,0.0,0.0,0.0,0.0,0.0,
230022,230023,22 213339 BLD,0,Small Residential Projects,2 Unit - Detached,Second Suite (New),18,TWENTY SEVENTH,ST, ,M8W,7640248.0,W0334,2022-10-05,2023-01-26,,Inspection,Proposal to legalize the existing basement as a second unit,Sfd,2 Unit Dwelling,1.0,0.0,1000,0.0,0.0,0.0,0.0,0.0,0.0,0.0,0.0,
230122,230123,22 213641 BLD,0,Small Residential Projects,2 Unit - Detached,Second Suite (New),41,GLENTHORNE,DR, ,M1C,338328.0,E2532,2022-10-05,2022-10-28,,Permit Issued,Creation of 2nd Unit + Below grade entrance + 1 Window Enlargement+1 New WindowWith Plumbing and HVAC,Sfd,Sfd W/ Basement Unit,1.0,0.0,40000,0.0,0.0,0.0,0.0,0.0,0.0,0.0,0.0,
230126,230127,22 213730 BLD,0,Small Residential Projects,2 Unit - Semi-detached,Second Suite (New),98,PEMBROKE,ST, ,M5A,2594775.0,S1328,2022-10-05,2022-12-23,,Permit Issued,Proposla to construct a secondary suite in the basement,Sfd,2 Unit Dwelling,0.0,0.0,20000,0.0,0.0,0.0,0.0,0.0,0.0,0.0,0.0,
230289,230290,22 214385 BLD,0,Small Residential Projects,2 Unit - Detached,Second Suite (New),50,CARSLAKE,CRES, ,M1J,316854.0,E2135,2022-10-07,2022-10-25,,Permit Issued,Proposal to alter an existing detached dwelling to create a new basement secondary suite through interior alterations. ,Detached Sfd,2 Unit Detached,1.0,0.0,"15,000",0.0,0.0,0.0,0.0,0.0,0.0,0.0,0.0,
230334,230335,22 214596 BLD,0,Small Residential Projects,2 Unit - Detached,Second Suite (New),42,BARDWELL,CRES, ,M1R,304485.0,E2131,2022-10-07,2022-10-21,,Permit Issued,Interior alterations to basement for a second unit,Sfd,Sfd,1.0,0.0,25000,0.0,0.0,0.0,0.0,0.0,0.0,0.0,0.0,
230439,230440,22 215560 BLD,0,Small Residential Projects,2 Unit - Detached,Second Suite (New),36,RONWAY,CRES, ,M1J,380151.0,E2429,2022-10-11,2022-10-25,,Inspection,Proposal to construct interior alterations to convert an existing basement into a secondary unit. ,Detached Sfd,Detached 2 Unit,1.0,0.0,"50,000",0.0,0.0,0.0,0.0,0.0,0.0,0.0,0.0,
230740,230741,22 217040 BLD,0,Small Residential Projects,2 Unit - Detached,Second Suite (New),27,KINGSVIEW,BLVD, ,M9R,9963013.0,W0134,2022-10-14,2023-01-13,,Inspection,Renovation of Basement to accomodate rentable dwelling unit. Powder Room added to ground floor.,Sfd Detached,2 Units Detached,1.0,0.0,"120,000",0.0,0.0,0.0,0.0,0.0,0.0,4.0,0.0,
230760,230761,22 217146 BLD,0,Small Residential Projects,3+ Unit - Semi-detached,Second Suite (New),134,VICTORY,DR, ,M3M,572132.0,N0627,2022-10-14,2023-01-31,,Inspection,alteration on Basement level to create secondary suite ,2unit,3units,1.0,0.0,1000,0.0,0.0,0.0,0.0,0.0,0.0,38.53,0.0,
230772,230773,22 217170 BLD,0,Small Residential Projects,2 Unit - Detached,Second Suite (New),450,MELROSE,AVE, ,M5M,542365.0,N0824,2022-10-14,2022-10-24,,Permit Issued,Interior alterations of existing basement to create a basement apartment in a existing dwelling.,Sfd,2unit,1.0,0.0,10000,0.0,0.0,0.0,0.0,0.0,0.0,71.44,0.0,
230850,230851,22 217624 BLD,0,Small Residential Projects,2 Unit - Semi-detached,Second Suite (New),99,GREENWOOD,AVE, ,M4L,3897705.0,S1439,2022-10-16,2022-10-26,,Permit Issued,Proposed interior alterations and second unit to an existing semi-detached dwelling,Sfd,2 Unit Dwelling,1.0,0.0,25000,0.0,0.0,0.0,0.0,0.0,0.0,136.51,0.0,
230932,230933,22 217991 BLD,0,Small Residential Projects,2 Unit - Detached,Second Suite (New),8,MILROY,CRES, ,M1C,2216441.0,E2532,2022-10-17,2022-10-25,,Inspection,Proposal for interior alterations to add a 2nd suite in the basement of an existing SFD-detached dwelling. See also 22 214124 WNP.,Sfd-Detached,2 Unit Detached,1.0,0.0,"120,000",0.0,0.0,0.0,0.0,0.0,0.0,105.0,0.0,
231053,231054,22 218458 BLD,1,Small Residential Projects,2 Unit - Detached,Second Suite (New),6,JOHN GARLAND,BLVD, ,M9V,1009938.0,W0123,2023-05-09,2023-06-12,,Revision Issued,Proposed second dwelling unit in the basement including below grade entrance through garage and one enlarged window.,Sfd,2 Unit Dwelling,1.0,0.0,0,0.0,0.0,0.0,0.0,0.0,0.0,0.0,0.0,
231054,231055,22 218458 BLD,0,Small Residential Projects,2 Unit - Detached,Second Suite (New),6,JOHN GARLAND,BLVD, ,M9V,1009938.0,W0123,2022-10-18,2022-12-05,,Permit Issued,Proposed second dwelling unit in the basement including below grade entrance through garage and one enlarged window.,Sfd,2 Unit Dwelling,1.0,0.0,50000,0.0,0.0,0.0,0.0,0.0,0.0,7.52,0.0,
231109,231110,22 218610 BLD,0,Small Residential Projects,2 Unit - Detached,Second Suite (New),31,BLACKBUSH,DR, ,M9V,10537959.0,W0123,2022-10-18,2023-01-09,,Inspection,"Proposal for a basement apartment, new window, enlargement of existing window and basement finishing in the existing one storey detached single family house.",Sfd Detached,2 Unit Sfd Detached,1.0,0.0,25000,0.0,0.0,0.0,0.0,0.0,0.0,0.0,0.0,
231318,231319,22 219497 BLD,0,Small Residential Projects,2 Unit - Detached,Second Suite (New),63,CLEARBROOKE,CRCL, ,M9W,9667876.0,W0130,2022-10-20,2022-12-05,,Inspection,Proposal to legalize existing basement secondary suite. ,Detached Sfd,2 Unit Detached,1.0,0.0,"20,000",0.0,0.0,0.0,0.0,0.0,0.0,0.0,0.0,
231397,231398,22 219744 BLD,0,Small Residential Projects,2 Unit - Semi-detached,Second Suite (New),3,ROBLOCKE,AVE, ,M6G,860240.0,S1124,2022-10-20,2022-12-19,,Permit Issued,Proposed secondary suite in basement of existing dwelling. Work to include interior alterations of basement,Sfd Semi-Detached,2-Unit Semi-Detached,1.0,0.0,"30,000",0.0,0.0,0.0,0.0,0.0,0.0,0.0,0.0,
231442,231443,22 219984 BLD,0,Small Residential Projects,2 Unit - Detached,Second Suite (New),43,QUIETBROOK,CRES, ,M1X,14645514.0,E2326,2022-10-21,2023-02-03,,Inspection,Proposal to construct a secondary suite in the basement,Sfd,Sfd,1.0,0.0,35000,0.0,0.0,0.0,0.0,0.0,0.0,0.0,0.0,
231772,231773,22 221689 BLD,0,Small Residential Projects,2 Unit - Detached,Second Suite (New),33,BOBMAR,RD, ,M1C,310100.0,E2532,2022-10-25,2022-11-17,,Inspection,Proposal to convert the existing dwelling into 2 units house with interior alteration. ,Sfd,2 Units,1.0,0.0,10000,0.0,0.0,0.0,0.0,0.0,0.0,131.8,0.0,
231911,231912,22 222226 BLD,0,Small Residential Projects,2 Unit - Detached,Second Suite (New),24,CEDARVIEW,DR, ,M1C,14645193.0,E2535,2022-10-26,,,Examiner's Notice Sent,Proposed to convert basement into a secondary suite.,Sfd,Sfd With New 2nd Suite In Basement,1.0,0.0,"30,000.00",0.0,0.0,0.0,0.0,0.0,0.0,0.0,0.0,
232107,232108,22 223149 BLD,0,Small Residential Projects,2 Unit - Detached,Second Suite (New),46,ECKER,DR, ,M8W,7641078.0,W0330,2022-10-28,2023-01-23,,Inspection,Designing a basement as per OBC in order to make a secondary suite,Sfd,Sfd,1.0,0.0,"35,000",0.0,0.0,0.0,0.0,0.0,0.0,0.0,0.0,
232382,232383,22 224664 BLD,1,Small Residential Projects,2 Unit - Townhouse,Second Suite (New),77,NORMAN WESLEY,WAY, ,M3M,14069797.0,N0627,2023-07-12,,,Application Acceptable,REVISION 01: Door requires a step down on site . Propose a concrete landing with drainage.To convert the existing basement to a secondary suite,Single Family Townhouse,2 Unit Dwelling - Townhouse,1.0,0.0,0,0.0,0.0,0.0,0.0,0.0,0.0,0.0,0.0,
232383,232384,22 224664 BLD,0,Small Residential Projects,2 Unit - Townhouse,Second Suite (New),77,NORMAN WESLEY,WAY, ,M3M,14069797.0,N0627,2022-11-01,2023-02-01,,Inspection,To convert the existing basement to a secondary suite,Single Family Townhouse,2 Unit Dwelling - Townhouse,1.0,0.0,"10,000",0.0,0.0,0.0,0.0,0.0,0.0,42.3,0.0,
232854,232855,22 227360 BLD,0,Small Residential Projects,2 Unit - Detached,Second Suite (New),37,MARCELLA,ST, ,M1G,359501.0,E2431,2022-11-08,2022-11-21,,Inspection,"Proposed conversion of basement into secondary suite, and new basement door",Sfd Detached,2-Unit Detached,1.0,0.0,"25,000",0.0,0.0,0.0,0.0,0.0,0.0,0.0,0.0,
232863,232864,22 227390 BLD,0,Small Residential Projects,2 Unit - Detached,Second Suite (New),75,CRONIN,DR, ,M9B,995097.0,W0234,2022-11-08,2023-04-17,,Inspection,To legalize second unit in basement,Sfd,Sfd-Two Unit,1.0,0.0,20000,0.0,0.0,0.0,0.0,0.0,0.0,0.0,0.0,
232902,232903,22 227617 BLD,0,Small Residential Projects,2 Unit - Detached,Second Suite (New),75,ELLINGTON,DR, ,M1R,2820904.0,E2127,2022-11-09,2023-02-10,,Permit Issued,Proposed basement suite.,Sfd,2 Unit Dwelling,1.0,0.0,30000,0.0,0.0,0.0,0.0,0.0,0.0,0.0,0.0,
233509,233510,22 230609 BLD,0,Small Residential Projects,2 Unit - Detached,Second Suite (New),100,WESTBOURNE,AVE, ,M1L,396964.0,E2028,2022-11-17,2023-01-25,,Permit Issued,Proposal to construct interior alterations in the basement for a secondary suite,Sfd,2 Unit Dwelling,1.0,0.0,90000,0.0,0.0,0.0,0.0,0.0,0.0,8.0,0.0,
233633,233634,22 230995 BLD,0,Small Residential Projects,2 Unit - Detached,Second Suite (New),17,ALBERTA,AVE, ,M6H,10872684.0,S0928,2022-11-18,2023-02-01,,Inspection,Interior alteration to add a secondary suite and rear deck,Sfd,2 Unit Dwelling,1.0,0.0,"150,000",0.0,0.0,0.0,0.0,0.0,0.0,58.94,0.0,
233675,233676,22 231369 BLD,0,Small Residential Projects,2 Unit - Detached,Second Suite (New),34,TORRANCE,RD, ,M1J,392046.0,E2136,2022-11-21,2023-01-09,,Inspection,proposing to construct a new second suite in the basement ,Sfd,Sfd,1.0,0.0,80000,0.0,0.0,0.0,0.0,0.0,0.0,0.0,0.0,
233783,233784,22 231650 BLD,0,Small Residential Projects,2 Unit - Detached,Second Suite (New),29,WILLOWHURST,CRES, ,M1R,398376.0,E2127,2022-11-21,2023-04-03,,Inspection,"Proposed second suite at existing finished basement:_The second kitchen removal at basement, window widening at basement living /dining area, _New proposed window and egress window well at basement,_Additional bedroom walls at basement,_Fire rated wall addition at stair 1",Sfd,2 Unit Dwelling,1.0,0.0,45000,0.0,0.0,0.0,0.0,0.0,0.0,0.0,0.0,
233829,233830,22 231881 BLD,0,Small Residential Projects,2 Unit - Detached,Second Suite (New),1482,ISLINGTON,AVE, ,M9A,1009035.0,W0228,2022-11-22,2023-01-27,,Permit Issued,Proposal to construct a secondary suite in the basement,Sfd,Sfd,1.0,0.0,5000,0.0,0.0,0.0,0.0,0.0,0.0,0.0,0.0,
234053,234054,22 232516 BLD,0,Small Residential Projects,2 Unit - Detached,Second Suite (New),67,BRENDA,CRES, ,M1K,311564.0,E2023,2022-11-23,2022-12-06,,Inspection,"Basement to be converted to finished basement apartment, two enlarged windows, laundry on ground floor",Sfd Detached,2 Unit Detached,1.0,0.0,80000,0.0,0.0,0.0,0.0,0.0,0.0,0.0,0.0,
234077,234078,22 232693 BLD,0,Small Residential Projects,2 Unit - Detached,Second Suite (New),12,ST HILDA'S,AVE, ,M4N,873811.0,N1526,2022-11-24,2022-12-07,,Inspection,"Add second unit in basement, basement walkout stairs at rear, and interior alteration to second floor.",Sfd,2 Family Dwelling,1.0,0.0,25000,0.0,0.0,0.0,0.0,0.0,0.0,8.9,0.0,
234130,234131,22 232912 BLD,0,Small Residential Projects,2 Unit - Detached,Second Suite (New),58,EMMELINE,CRES, ,M1S,332256.0,E2228,2022-11-24,,,Examiner's Notice Sent,Proposal for interior alterations to add a 2nd suite in the basement of an existing 1 storey detached dwelling.,Sfd-Detached,2 Unit Detached,1.0,0.0,"35,000",0.0,0.0,0.0,0.0,0.0,0.0,97.0,0.0,
234149,234150,22 232991 BLD,0,Small Residential Projects,2 Unit - Detached,Second Suite (New),17,BENSTROW,AVE, ,M9V,987067.0,W0124,2022-11-24,,,Under Review ,SECOND DWELLING UNIT IN BASEMENT; THREE(3) NEW WINDOWS IN BASEMENT INCLUDING ONE(1) EGRESS WINDOW IN BASEMENT; TWO(2) ENLARGE WINDOWS IN BASEMENT IN THE EXISTING DETACHED ONE STOREY HOUSE. ,Sfd Detached,2 Unit Sfd Detached,1.0,0.0,"97,3000",0.0,0.0,0.0,0.0,0.0,0.0,0.0,0.0,
234289,234290,22 233883 BLD,0,Small Residential Projects,2 Unit - Detached,Second Suite (New),7,BLANDFORD,ST, ,M6E,52981.0,S1222,2022-11-28,2023-01-04,,Inspection,"Proposed interior alterations, rear porch construction, legalize existing secondary suite",Sfd,Sfd,1.0,0.0,"50,000.00",0.0,0.0,0.0,0.0,0.0,0.0,65.0,0.0,
234295,234296,22 233938 BLD,0,Small Residential Projects,2 Unit - Detached,Second Suite (New),12,ERIE,ST, ,M6L,512938.0,W0526,2022-11-28,2023-02-22,,Permit Issued,To legalize existing basement second unit,Sfd,Two Unit - Sfd,1.0,0.0,30000,0.0,0.0,0.0,0.0,0.0,0.0,0.0,0.0,
234399,234400,22 234490 BLD,0,Small Residential Projects,2 Unit - Detached,Second Suite (New),378,LAUDER,AVE, ,M6E,66506.0,S0925,2022-11-29,2023-03-31,,Inspection,1. Add dormers with windows to existing sloped roof.  Attic only. 2. To legalize the basement dwelling unit,Sfd - Detached,2 Unit - Detached,1.0,0.0,"50,000",0.0,0.0,0.0,0.0,0.0,0.0,40.99,0.0,
234445,234446,22 234680 BLD,0,Small Residential Projects,2 Unit - Detached,Second Suite (New),36,HINTON,RD, ,M9W,1007406.0,W0130,2022-11-30,2023-03-08,,Inspection,Proposed Second Suite (New) in the basement and to enlarged one window to egress in basement.,Sfd,Sfd With New 2nd Suit In Basement,1.0,0.0,"68,850.00",0.0,0.0,0.0,0.0,0.0,0.0,68.85,0.0,
234496,234497,22 234783 BLD,0,Small Residential Projects,2 Unit - Detached,Second Suite (New),900,KENNEDY,RD, ,M1K,350419.0,E2133,2022-11-30,2023-04-17,,Permit Issued,Proposal to add a 2nd suite in the basement of an existing detached dwelling.,Sfd-Detached,2 Unit Detached,1.0,0.0,"102,900",0.0,0.0,0.0,0.0,0.0,0.0,0.0,0.0,
234617,234618,22 235183 BLD,0,Small Residential Projects,2 Unit - Detached,Second Suite (New),6,MANAHAM,RD, ,M1E,358896.0,E2538,2022-12-01,2022-12-23,,Permit Issued,Proposal to construct a secondary unit in the basement,Sfd,2 Unit Dwelling,1.0,0.0,20000,0.0,0.0,0.0,0.0,0.0,0.0,0.0,0.0,
234751,234752,22 236066 BLD,0,Small Residential Projects,2 Unit - Detached,Second Suite (New),19,LORMAR,DR, ,M9B,1015682.0,W0234,2022-12-05,,,Examiner's Notice Sent,Proposed convert existing finished basement to secondary unit,Sfd,Sfd With New 2nd Suite In Basment,1.0,0.0,"100,000.00",0.0,0.0,0.0,0.0,0.0,0.0,0.0,0.0,
234769,234770,22 236176 BLD,0,Small Residential Projects,2 Unit - Detached,Second Suite (New),21,ATLEE,AVE, ,M1N,303490.0,E2031,2022-12-05,2023-01-26,,Revocation Pending,Construct a basement secondary unit,Sfd,2 Unit Sfd,1.0,0.0,"50,000",0.0,0.0,0.0,0.0,0.0,0.0,0.0,0.0,
235296,235297,22 238198 BLD,0,Small Residential Projects,2 Unit - Detached,Second Suite (New),41,SUGARBUSH,SQ, ,M1C,30109698.0,E2532,2022-12-09,2023-03-08,,Inspection,Proposal for a new second unit in the basement and interior alteration/one new window in the basement.,Sfd,2 Units,1.0,0.0,40000,0.0,0.0,0.0,0.0,0.0,0.0,0.0,0.0,
235328,235329,22 238523 BLD,0,Small Residential Projects,2 Unit - Detached,Second Suite (New),260,BEECHGROVE,DR, ,M1E,305627.0,E2534,2022-12-12,2023-04-11,,Permit Issued,To create a legal second unit in basement,Sfd,Two Unit - Sfd,1.0,0.0,40000,0.0,0.0,0.0,0.0,0.0,0.0,0.0,0.0,
235390,235391,22 238794 BLD,0,Small Residential Projects,2 Unit - Detached,Second Suite (New),354,ALBANY,AVE, ,M5R,761532.0,S1236,2022-12-12,,,Response Received,Proposed for a Legal Basement permit with Walkout ,Sfd,2 Unit House,1.0,0.0,40000,0.0,0.0,0.0,0.0,0.0,0.0,0.0,0.0,
235403,235404,22 238846 BLD,0,Small Residential Projects,2 Unit - Detached,Second Suite (New),15,CALAIS,AVE, ,M3M,495322.0,N0627,2022-12-12,2023-01-17,,Inspection,Proposed second legal unit in basement and walk up basement at the rear of the house,Sfd,2 Unit,1.0,0.0,20000,0.0,0.0,0.0,0.0,0.0,0.0,115.31,0.0,
235454,235455,22 239095 BLD,0,Small Residential Projects,2 Unit - Detached,Second Suite (New),189,TOYNBEE,TRL, ,M1E,392504.0,E2435,2022-12-13,2023-03-15,,Inspection,"Convert the existing basement to a second dwelling unit, two enlarged windows and one new egress window in the basement",Single Family,2 Unit Dwelling,1.0,0.0,"77,500",0.0,0.0,0.0,0.0,0.0,0.0,77.5,0.0,
236001,236002,22 240977 BLD,0,Small Residential Projects,2 Unit - Detached,Second Suite (New),288,JEFFCOAT,DR, ,M9W,2945694.0,W0128,2022-12-19,2023-02-13,,Permit Issued,Proposal to create a secondary unit in the basement of an exisitng single family dwelling ,Sfd,Sfd,1.0,0.0,"55,830.00",0.0,0.0,0.0,0.0,0.0,0.0,0.0,0.0,
236097,236098,22 241305 BLD,0,Small Residential Projects,2 Unit - Detached,Second Suite (New),5294,LAWRENCE,AVE,E,M1C,354668.0,E2535,2022-12-20,2023-04-03,,Inspection,Construct 2nd suite in basement (see file 21-129464 for basement walkout),Sfd,Sfd,1.0,0.0,12000,0.0,0.0,0.0,0.0,0.0,0.0,0.0,0.0,
236424,236425,22 242296 BLD,0,Small Residential Projects,Laneway / Rear Yard Suite,Second Suite (New),38,THIRTY THIRD,ST, ,M8W,7288075.0,W0334,2022-12-23,2023-03-22,,Inspection,Proposed construction of a new 2-storey garden suite in the rear yard of an existing 2-storey single family detached dwelling.,Sfd,Sfd + Garden Suite,1.0,0.0,435000,0.0,0.0,117.05,0.0,0.0,0.0,0.0,0.0,
236486,236487,22 242824 BLD,0,Small Residential Projects,2 Unit - Detached,Second Suite (New),79,GEORGE ANDERSON,DR, ,M6M,519475.0,W0529,2022-12-28,2023-02-16,,Inspection,PROPOSED: BASEMENT APARTMENT  & THIRD DWELLING UNIT IN EXISTING GARAGE ATSUBJECT PROPERTY,Sfd - Detached,3 Unit - Detached,1.0,0.0,5000,0.0,0.0,0.0,0.0,0.0,0.0,26.94,0.0,
236547,236548,22 242986 BLD,0,Small Residential Projects,2 Unit - Detached,Second Suite (New),67,SHIPPIGAN,CRES, ,M2J,562407.0,N1727,2022-12-29,,,Examiner's Notice Sent,Below grade separate entrance opening from sideApplicant send email confirming is second suite unit DOU attached in correspondence/ na,Sfd Detached,2 Unit Detached,,,"15,000",0.0,0.0,0.0,0.0,0.0,0.0,0.0,0.0,
236716,236717,23 100139 BLD,0,Small Residential Projects,2 Unit - Detached,Second Suite (New),136,LIONHEAD,TRL, ,M1B,2485964.0,E2530,2023-01-03,,,Issuance Pending,"Existing basement converted to finished basement apartment, new concrete walk up, one new window and one enlarged window.",Sfd,2units,1.0,0.0,80000,0.0,0.0,0.0,0.0,0.0,0.0,46.34,0.0,
236800,236801,23 100533 BLD,0,Small Residential Projects,2 Unit - Detached,Second Suite (New),11,EASTMOOR,CRES, ,M1N,330147.0,E2035,2023-01-04,2023-06-29,,Permit Issued,Proposal to construct a secondary suite in the basement,Sfd,2 Unit Dwelling,1.0,0.0,40000,0.0,0.0,0.0,0.0,0.0,0.0,0.0,0.0,
236971,236972,23 101338 BLD,0,Small Residential Projects,2 Unit - Semi-detached,Second Suite (New),51,BLACK CREEK,BLVD, ,M6N,7754431.0,W0534,2023-01-06,2023-02-10,,Inspection,Proposal to legalize existing basement as secondary unit,Sfd - Detached,2 Unit - Semi- Detached,1.0,0.0,5000,0.0,0.0,0.0,0.0,0.0,0.0,0.0,0.0,
236979,236980,23 101377 BLD,0,Small Residential Projects,2 Unit - Detached,Second Suite (New),35,HEARTH,PL, ,   ,30117598.0,E2532,2023-01-06,2023-01-17,,Inspection,Proposed secondary suite in basement of existing Single Family Dwelling,Sfd,2 Unit Sfd,0.0,0.0,45000,0.0,0.0,0.0,0.0,0.0,0.0,0.0,0.0,
237007,237008,23 101516 BLD,0,Small Residential Projects,2 Unit - Townhouse,Second Suite (New),753,GERRARD,ST,E,M4M,808523.0,S1434,2023-01-06,,,Refusal Notice,Proposed second suite on 2nd & 3rd floor,Sfd Townhouse,2 Units Townhouse,2.0,0.0,"10,000",0.0,0.0,0.0,0.0,0.0,0.0,0.0,0.0,
237042,237043,23 101971 BLD,0,Small Residential Projects,2 Unit - Detached,Second Suite (New),56,ARKLEY,CRES, ,M9R,984420.0,W0221,2023-01-09,2023-02-03,,Inspection,PROPOSED: CREATION OF A SECOND UNIT IN A PROPOSED BASEMENT AND TWO EXISTING WINDOWS TO BE ENLARGED.,Residential- Single Dwelling,Residential- Two Unit Dwelling,1.0,0.0,50000,0.0,0.0,0.0,0.0,0.0,0.0,0.0,0.0,
237079,237080,23 102118 BLD,0,Small Residential Projects,2 Unit - Detached,Second Suite (New),14,GILROY,DR, ,M1P,337365.0,E2128,2023-01-09,2023-04-17,,Permit Issued,Proposed to legalize basement secondary suite to existing dwelling ,Sfd,2 Unit Detached,0.0,0.0,40000,0.0,0.0,0.0,0.0,0.0,0.0,80.0,0.0,
237412,237413,23 104541 BLD,0,Small Residential Projects,2 Unit - Detached,Second Suite (New),35,ADENCLIFF,RD, ,M1W,300431.0,E2225,2023-01-17,2023-01-24,,Inspection,Proposal for interior alterations to add a 2nd suite in the basement of an existing 1 storey detached dwelling.,Sfd - Detached,Sfd - Detached,1.0,0.0,"22,000",0.0,0.0,0.0,0.0,0.0,0.0,60.89,0.0,
237492,237493,23 104857 BLD,0,Small Residential Projects,2 Unit - Detached,Second Suite (New),198,WOODMOUNT,AVE, ,M4C,37913.0,S1925,2023-01-18,2023-01-31,,Permit Issued,ITo convert the existing two-storey detached dwelling from one unit into two units (one primary unit  on ground floor and one secondary on the second floor suite) by extending the existing roof to the rear of the dwelling and reconstructing a rear ground level deck.,Sfd,2 Unit Dwelling,1.0,0.0,"20,000",0.0,0.0,0.0,0.0,0.0,0.0,96.97,0.0,
237494,237495,23 104859 BLD,0,Small Residential Projects,2 Unit - Detached,Second Suite (New),68,MILLVIEW,CRES, ,M9W,1019058.0,W0128,2023-01-18,2023-01-27,,Inspection,To convert basement into a secondary suite.,Sfd-Detached,2-Unit Detached,1.0,0.0,"20,000",0.0,0.0,0.0,0.0,0.0,0.0,0.0,0.0,
237554,237555,23 105085 BLD,0,Small Residential Projects,2 Unit - Detached,Second Suite (New),40,ELDER,AVE, ,M8W,998863.0,W0334,2023-01-18,2023-01-26,,Permit Issued,Proposal to construct a secondary suite in the basement,Sfd - Detached,2 Unit Dwelling,1.0,0.0,0,0.0,0.0,0.0,0.0,0.0,0.0,0.0,0.0,
237590,237591,23 105322 BLD,0,Small Residential Projects,2 Unit - Detached,Second Suite (New),77,NASH,DR, ,M3M,544719.0,N0627,2023-01-19,2023-02-06,,Inspection,To propose a second dwelling unit in basement,Sfd - Detached,2 Unit Sfd Detached,1.0,0.0,"40,000",0.0,0.0,0.0,0.0,0.0,0.0,0.0,0.0,
